{
  "id": "windows-build-validation",
  "interfaceVersion": "1.0.0",
  "tier": 0,
  "timeoutSeconds": 3600,
  "displayName": "Windows Build Validation",
  "description": "MSVC/CMake toolchain discovery, Debug/Release/static-analysis builds, and the ctest unit+fuzz suites.",
  "entryModule": "Build.psm1",
  "dependsOn": [],
  "repairPosture": "repair-supported",
  "entryPoints": {
    "availability": "Test-BuildCapabilityAvailability",
    "run": "Invoke-BuildCapability",
    "diagnostics": "Get-BuildCapabilityDiagnostics",
    "repair": "Invoke-BuildCapabilityRepair"
  }
}
